<?xml version="1.0" encoding="utf-8"?>
<!-- (1) Root element is "Hotel" instead of "Hotels" -->
<Hotel xmlns:xsi="http://www.w3.org/2001/XMLSchema-instance"
       xsi:noNamespaceSchemaLocation="https://dabestcode.github.io/XML-XSD/Hotels.xsd">

  <!-- Hotel 1 with multiple errors -->
  <Hotel ID="H1" Category="Luxury">
    <!-- (5) Two Name elements -->
    <Name>Westin</Name>
    <Name>AnotherName</Name>
    <!-- Missing <Phone> entirely (3) -->
    <!-- (4) <Address> has no closing tag -->
    <Address NearstAirport="Sky Harbor">
      <Number>11</Number>
      <Street>E 7th St</Street>
      <City>Tempe</City>
      <State>AZ</State>
      <Zip>85281</Zip>
    <!-- No closing </Address> -->
    <Rating>4.2</Rating>
  </Hotel>

  <!-- Hotel 2 missing required attribute ID (2) -->
  <Hotel Category="Budget">
    <Name>Courtyard</Name>
    <Phone>480-555-1234</Phone>
    <Address>
      <Number>123</Number>
      <Street>Example Rd</Street>
      <City>Phoenix</City>
      <State>AZ</State>
      <Zip>85004</Zip>
    </Address>
  </Hotel>

</Hotel>
