<?xml version="1.0" encoding="utf-8"?>
<Hotels xmlns:xsi="http://www.w3.org/2001/XMLSchema-instance"
         xsi:noNamespaceSchemaLocation="https://dabestcode.github.io/XML-XSD/Hotels.xsd">
 
   <!-- Hotel 1 -->
  <Hotel Name="Westin" NearstAirport="Sky Harbor" Rating="4.2">
    <Phone>480-968-8885</Phone>
    <Phone>800-937-8461</Phone>
    <Address>
      <Number>11</Number>
      <Street>E 7th St</Street>
      <City>Tempe</City>
      <State>AZ</State>
      <Zip>85281</Zip>
    </Address>
  </Hotel>

  <!-- Hotel 2 -->
  <Hotel Name="Courtyard" NearstAirport="Sky Harbor">
    <Phone>480-555-1234</Phone>
    <Address>
      <Number>123</Number>
      <Street>Example Rd</Street>
      <City>Phoenix</City>
      <State>AZ</State>
      <Zip>85004</Zip>
    </Address>
  </Hotel>

  <!-- Hotel 3 -->
  <Hotel Name="Desert Oasis" NearstAirport="Sky Harbor" Rating="3.8">
    <Phone>480-777-2222</Phone>
    <Address>
      <Number>45</Number>
      <Street>Sunset Blvd</Street>
      <City>Scottsdale</City>
      <State>AZ</State>
      <Zip>85250</Zip>
    </Address>
  </Hotel>

  <!-- Hotel 4 -->
  <Hotel Name="Grand Hotel" NearstAirport="Sky Harbor">
    <Phone>602-654-9870</Phone>
    <Phone>602-654-9871</Phone>
    <Address>
      <Number>989</Number>
      <Street>Downtown Ave</Street>
      <City>Phoenix</City>
      <State>AZ</State>
      <Zip>85003</Zip>
    </Address>
  </Hotel>

  <!-- Hotel 5 -->
  <Hotel Name="Riverside Inn" NearstAirport="Mesa Gateway" Rating="4.0">
    <Phone>623-900-4567</Phone>
    <Address>
      <Number>210</Number>
      <Street>Riverside Dr</Street>
      <City>Mesa</City>
      <State>AZ</State>
      <Zip>85201</Zip>
    </Address>
  </Hotel>

  <!-- Hotel 6 -->
  <Hotel Name="Redwood Suites" NearstAirport="Flagstaff Pulliam">
    <Phone>928-111-2233</Phone>
    <Address>
      <Number>808</Number>
      <Street>Forest Trail</Street>
      <City>Flagstaff</City>
      <State>AZ</State>
      <Zip>86001</Zip>
    </Address>
  </Hotel>

  <!-- Hotel 7 -->
  <Hotel Name="MountainView Lodge" NearstAirport="Tucson International" Rating="4.5">
    <Phone>520-222-3344</Phone>
    <Phone>520-222-3345</Phone>
    <Address>
      <Number>77</Number>
      <Street>Valley Rd</Street>
      <City>Tucson</City>
      <State>AZ</State>
      <Zip>85705</Zip>
    </Address>
  </Hotel>

  <!-- Hotel 8 -->
  <Hotel Name="Blue Lagoon" NearstAirport="Lake Havasu Airport" Rating="3.9">
    <Phone>928-440-2200</Phone>
    <Address>
      <Number>500</Number>
      <Street>Lakeshore Ave</Street>
      <City>Lake Havasu City</City>
      <State>AZ</State>
      <Zip>86403</Zip>
    </Address>
  </Hotel>

  <!-- Hotel 9 -->
  <Hotel Name="City Comfort" NearstAirport="Sky Harbor">
    <Phone>602-555-0199</Phone>
    <Address>
      <Number>1501</Number>
      <Street>Central Blvd</Street>
      <City>Phoenix</City>
      <State>AZ</State>
      <Zip>85014</Zip>
    </Address>
  </Hotel>

  <!-- Hotel 10 -->
  <Hotel Name="Sunshine Retreat" NearstAirport="Glendale Municipal" Rating="4.7">
    <Phone>623-120-0000</Phone>
    <Address>
      <Number>980</Number>
      <Street>Sunrise Ct</Street>
      <City>Glendale</City>
      <State>AZ</State>
      <Zip>85305</Zip>
    </Address>
  </Hotel>

</Hotels>
